{
  "schema_version": 2,
  "matrix_sha256": "5cfc331153dcacb350a0f1aa09dd576dea14d12e1d25bec757007ac055445059",
  "created_at": "2026-10-31T00:00:00+00:00",
  "cases": [
    {
      "id": "read-resource",
      "actor": "anonymous",
      "expected": [
        200
      ],
      "actual": 200,
      "outcome": "fail",
      "assertions": [
        {
          "id": "allowed-field",
          "outcome": "fail"
        }
      ]
    }
  ]
}
