{
  "schema_version": 1,
  "matrix_sha256": "69c9eb76535bca65a13a5e0cde507bc3bf8dd2ee636ee6ca3cb5c5751461350d",
  "created_at": "2026-10-31T00:00:00+00:00",
  "cases": [
    {
      "id": "read-resource",
      "actor": "anonymous",
      "expected": [
        200
      ],
      "actual": 403,
      "outcome": "fail"
    }
  ]
}
